{
  "$schema": "http://json-schema.org/draft-07/schema#",
  "title": "Governance Registry Record",
  "type": "object",
  "additionalProperties": false,
  "required": [
    "registry_id",
    "item_type",
    "item_id",
    "owner",
    "created_at",
    "updated_at",
    "versions"
  ],
  "properties": {
    "registry_id": { "type": "string", "minLength": 1 },
    "item_type": { "type": "string", "enum": ["playbook", "policy"] },
    "item_id": { "type": "string", "minLength": 1 },
    "owner": { "type": "string", "minLength": 1 },
    "created_at": { "type": "string", "format": "date-time" },
    "updated_at": { "type": "string", "format": "date-time" },
    "versions": {
      "type": "array",
      "minItems": 1,
      "items": {
        "type": "object",
        "additionalProperties": false,
        "required": [
          "version",
          "status",
          "released_at",
          "checksum",
          "run_id",
          "artifact_refs"
        ],
        "properties": {
          "version": { "type": "string", "minLength": 1 },
          "status": { "type": "string", "enum": ["draft", "active", "deprecated"] },
          "released_at": { "type": "string", "format": "date-time" },
          "checksum": { "type": "string", "minLength": 1 },
          "run_id": { "type": "string", "minLength": 1 },
          "artifact_refs": {
            "type": "array",
            "items": { "type": "string" }
          }
        }
      }
    }
  }
}
